{
  "$schema": "../../contracts/projections/testcase-ontology/testcase-library/schemas/test-case.schema.json",
  "test_case_id": "tc-001-logistics-urgent-positive",
  "version": "2.0.0",
  "title": "物流催派 - 停滞超48小时触发催派",
  "description": "李阿姨的降压茶卡在分拣中心超过48小时，小服识别后触发催派流程",
  "applicable_roles": [
    "customer-service-ecommerce"
  ],
  "applicable_scenarios": [
    "logistics_query",
    "urgent_delivery"
  ],
  "difficulty": "medium",
  "tags": [
    "logistics",
    "urgent",
    "elderly-customer"
  ],
  "polarity": "positive",
  "paired_case_id": "tc-002-logistics-no-urgent-negative",
  "input": {
    "opening_message": "小姑娘，我买的降压茶怎么还不来？我看手机上说已经在路上了，但两天没动了。我着急用。",
    "customer_persona": {
      "name": "李阿姨",
      "age_band": "60-65",
      "personality": [
        "kind",
        "patient",
        "not-tech-savvy"
      ],
      "communication_style": "口语化、礼貌、打字较慢",
      "patience_level": "medium"
    },
    "initial_emotion": "anxious",
    "goal": {
      "primary": "确认包裹位置并催促配送，尽快收到降压茶",
      "secondary": "了解为什么物流停滞了",
      "bottom_line": "至少知道包裹在哪，什么时候能到"
    },
    "context": {
      "order_id": "ORD20250527001",
      "product_name": "降压茶",
      "order_date": "2025-05-20",
      "tracking_number": "SF1234567890",
      "last_tracking_event": "2025-05-25 10:00 到达广州分拣中心",
      "stagnation_hours": 52,
      "customer_medication_urgency": true,
      "current_time": "2025-05-27 15:00"
    },
    "stop_conditions": {
      "success": "员工已查询物流轨迹、确认停滞超48小时、并提交了催派请求，且告知了预计回复时间",
      "failure": "员工无法查询物流、或承诺了无法兑现的送达时间、或拒绝帮助",
      "deadlock": "对话超过8轮仍未解决或转接"
    }
  },
  "turn_budget": {
    "hard_max_turns": 10,
    "soft_target_turns": 5
  },
  "expected_output": {
    "expected_tool_calls": [
      {
        "name": "query_order_status",
        "criticality": "must",
        "required_params": [
          "order_id"
        ],
        "notes": "必须先查到订单和运单信息"
      },
      {
        "name": "query_logistics_tracking",
        "criticality": "must",
        "required_params": [
          "tracking_number"
        ],
        "notes": "查询物流轨迹确认停滞状态"
      },
      {
        "name": "submit_urgent_delivery_request",
        "criticality": "must",
        "required_params": [
          "tracking_number",
          "carrier"
        ],
        "notes": "停滞超48小时必须提交催派"
      }
    ],
    "expected_response_traits": [
      "称呼客户为'李阿姨'体现尊重",
      "表达理解和共情（理解老人着急用药的心情）",
      "清晰说明查询结果：停滞位置和时长",
      "明确告知已提交催派及预计回复时间",
      "提供自助查询方式（订单详情页）",
      "询问是否有其他需要帮助"
    ],
    "forbidden_behaviors": [
      "承诺具体的送达时间（如'明天一定到'）",
      "要求客户自己联系物流公司",
      "让客户等待过长时间才响应",
      "使用过于技术化的术语"
    ],
    "expected_outcomes": [
      "客户知道包裹现状",
      "催派已提交，有工单号",
      "客户有明确的后续预期（今天6点前回复）",
      "客户满意度高"
    ]
  },
  "applicable_metrics": [
    "interaction_empathy",
    "tool_call_correctness"
  ],
  "provenance": {
    "source": "synthesized_from_user_scenarios",
    "source_ref": "用户提供的李阿姨降压茶案例",
    "generated_by": "evaluation-expert-consumer",
    "generated_at": "2026-05-29T14:00:00Z"
  }
}
