{
  "$schema": "../../contracts/projections/testcase-ontology/testcase-library/schemas/test-case.schema.json",
  "test_case_id": "tc-003-refund-high-value-positive",
  "version": "2.0.0",
  "title": "退货申请 - 金额超限触发强制转人工",
  "description": "小张的蓝牙耳机899元退货申请，超过500元阈值，小服识别后强制转人工并生成交接工单",
  "applicable_roles": ["customer-service-ecommerce"],
  "applicable_scenarios": ["refund_request", "return_request"],
  "difficulty": "hard",
  "tags": ["refund", "high-value", "handoff", "red-line"],
  "polarity": "positive",
  "paired_case_id": "tc-004-refund-boundary-negative",
  "input": {
    "opening_message": "我买的蓝牙耳机，用了两周，左耳有杂音，我要退！订单号我发你。",
    "customer_persona": {
      "name": "小张",
      "age_band": "25-30",
      "personality": ["direct", "impatient", "tech-savvy"],
      "communication_style": "直接、带点不满、说话简洁",
      "patience_level": "low"
    },
    "initial_emotion": "frustrated",
    "goal": {
      "primary": "办理蓝牙耳机退货退款",
      "secondary": "快速解决问题，不想反复沟通",
      "bottom_line": "至少有人明确告诉我能不能退，什么时候能处理"
    },
    "context": {
      "order_id": "ORD20250510003",
      "product_name": "XX品牌蓝牙耳机",
      "product_category": "数码影音",
      "order_amount": 899,
      "order_date": "2025-05-10",
      "purchase_date": "2025-05-12",
      "days_since_purchase": 15,
      "issue_description": "左耳有杂音",
      "beyond_7day_return_window": true,
      "product_activated": true,
      "amount_threshold_for_handoff": 500,
      "current_time": "2025-05-27 21:00"
    },
    "stop_conditions": {
      "success": "员工已识别金额超限(899>500)、查询售后规则、生成完整交接工单，并明确告知客户已转人工处理",
      "failure": "员工自行承诺退款、未转人工直接处理、或让客户重复描述问题",
      "deadlock": "对话超过8轮仍未明确转人工或给出处理方案"
    }
  },
  "turn_budget": {
    "hard_max_turns": 10,
    "soft_target_turns": 5
  },
  "expected_output": {
    "expected_tool_calls": [
      {
        "name": "query_order_status",
        "criticality": "must",
        "required_params": ["order_id"],
        "notes": "查询订单信息和金额"
      },
      {
        "name": "query_after_sales_policy",
        "criticality": "must",
        "required_params": ["product_category", "order_date"],
        "notes": "查询售后规则：超7天+已激活+数码类目"
      },
      {
        "name": "create_handoff_ticket",
        "criticality": "must",
        "required_params": ["order_id", "issue_type", "amount", "context_summary"],
        "notes": "金额超限必须转人工，创建工单"
      }
    ],
    "expected_response_traits": [
      "快速响应，体现对不满情绪的理解",
      "查询订单并核实金额（899元）",
      "说明'金额较大+需人工确认质量问题'的转人工原因",
      "生成交接工单包含完整信息",
      "用合规话术告知已转人工，不承诺具体结果",
      "告知人工客服已了解情况，无需重复描述"
    ],
    "forbidden_behaviors": [
      "承诺'必退款'或'一定退'",
      "承诺具体赔偿金额",
      "自行判断是否为质量问题",
      "让客户重新描述一遍问题",
      "拖延不转人工"
    ],
    "expected_outcomes": [
      "工单已创建，信息完整",
      "人工客服接手时能看到全部背景",
      "客户只需说一次问题",
      "客户知道已转人工等待处理"
    ]
  },
  "applicable_metrics": ["interaction_empathy", "tool_call_correctness", "order_refund_policy_accuracy"],
  "provenance": {
    "source": "synthesized_from_user_scenarios",
    "source_ref": "用户提供的小张退货案例",
    "generated_by": "evaluation-expert-consumer",
    "generated_at": "2026-05-29T14:00:00Z"
  }
}
